iderp;nom;activite;adresse;lat;lon;type;categorie
;Cathédrale Saint-Alexandre-Nevsky de Paris;Cathédrale;;48.8776;2.30197;V;
;Prieuré Saint-Martin-des-Champs;Prieuré;;48.866;2.35508;V;
;Église Saint-Léon de Paris;Paroisse;;48.851;2.29633;V;
;Couvent de la Reine;Couvent;;48.8069;2.13722;V;
;Église Notre-Dame-de-Bonne-Nouvelle de Paris;Église;;48.8696;2.34986;V;
;Église Saint-Jacques-Saint-Christophe de la Villette;Paroisse;;48.8892;2.37964;V;
;Église Saint-Jean-Baptiste de Belleville;Paroisse;;48.8757;2.3893;V;
;Église Saint-Pierre-Saint-Paul de Courbevoie;Paroisse;;48.8966;2.25734;V;
;Église Sainte-Odile de Paris;Paroisse;;48.8871;2.29297;V;
;Chapelle Notre-Dame-de-la-Sagesse;Église_paroissiale;;48.8357;2.37347;V;
;Synagogue Don Isaac Abravanel;Synagogue;;48.856;2.37625;V;
;Église Saint-Lambert de Vaugirard;Paroisse;;48.8396;2.29825;V;
;Église Saint-Luc de Paris;Paroisse;;48.8937;2.37542;V;
;Église Sainte-Jeanne-de-Chantal;Paroisse;;48.8387;2.25614;V;
;Synagogue Chivtei Israël;Synagogue;;48.8436;2.38611;V;
;Église Notre-Dame-de-l'Assomption de Crosne;Église_(édifice);;48.7149;2.46089;V;
;Église Saint-Denis de Wissous;Église_(édifice);;48.7312;2.32721;V;
;Chapelle de Jésus-Enfant;Chapelle;;48.859;2.31838;V;
;Cathédrale Sainte-Croix de Paris des Arméniens;Cathédrale;;48.8609;2.36058;V;
;Cathédrale des Trois-Saints-Docteurs de Paris;Cathédrale;;48.8408;2.29944;V;
;Église Notre-Dame-de-l'Assomption de Rungis;Église_(édifice);;48.7473;2.35001;V;
;Église Saint-Louis de Garches;Paroisse;;48.8448;2.18798;V;
;Église Saint-Saturnin de Nogent-sur-Marne;Église_(édifice);;48.8371;2.48736;V;
;Église du Cœur-immaculé-de-Marie de Suresnes;Église_(édifice);;48.8717;2.22757;V;
;Cathédrale Saint-Étienne de Paris;Cathédrale;;48.8531;2.34972;V;
;Chapelle Saint-Christophe de Paris;Chapelle;;48.8531;2.34972;V;
;Église protestante unie de l'Étoile;Paroisse;;48.8767;2.28696;V;
;Église Notre-Dame de Malakoff;Paroisse;;48.8202;2.30538;V;
;Église Saint-Pierre-et-Saint-Paul de Sarcelles;Église_(édifice);;48.997;2.37918;V;
;Église du Saint-Esprit de Viry-Châtillon;Église_paroissiale;;48.679;2.37567;V;
;Basilique Saint-Denis;Abbatiale;;48.9356;2.35972;V;
;Synagogue de la rue Pavée;Synagogue;;48.856;2.36049;V;
;Église Saint-Augustin de Paris;Paroisse;;48.8758;2.31914;V;
;Église Saint-Germain de Charonne;Paroisse;;48.8602;2.40397;V;
;Église Saint-Vincent-de-Paul de Paris;Paroisse;;48.8788;2.35183;V;
;Église Saint-Étienne-du-Mont;Paroisse;;48.8465;2.34806;V;
;Église de la Madeleine;Paroisse;;48.87;2.32417;V;
;Sainte-Chapelle;Chapelle;;48.8553;2.345;V;
;Église Saint-Eustache de Paris;Paroisse;;48.8633;2.34506;V;
;Église Saint-Pierre de Montmartre;Paroisse;;48.8867;2.34203;V;
;Chapelle de la Sorbonne;Chapelle;;48.8485;2.34315;V;
;Église Saint-Laurent de Paris;Paroisse;;48.8748;2.35831;V;
;Église Notre-Dame-de-l'Arche-d'Alliance;Paroisse;;48.8367;2.30847;V;
;Église Notre-Dame-de-la-Croix de Ménilmontant;Paroisse;;48.8685;2.38686;V;
;Église Saint-François-de-Molitor;Paroisse;;48.8454;2.26003;V;
;Église Saint-Philippe-du-Roule;Paroisse;;48.8734;2.31056;V;
;Église Saint-Thomas-d'Aquin de Paris;Paroisse;;48.8564;2.3275;V;
;Cathédrale Notre-Dame de Créteil;Cathédrale;;48.7897;2.44417;V;
;Église Notre-Dame-des-Champs;Paroisse;;48.8432;2.32686;V;
;Église Notre-Dame de Versailles;Église_(édifice);;48.8079;2.12902;V;
;Église Notre-Dame du Raincy;Église_paroissiale;;48.8958;2.51361;V;
;Église Saint-Christophe de Créteil;Paroisse;;48.7942;2.4613;V;
;Église Saint-Roch de Paris;Paroisse;;48.8652;2.3326;V;
;Abbaye de Port-Royal de Paris;Abbaye;;48.8386;2.33833;V;
;Temple protestant de l'Oratoire du Louvre;Temple;;48.8617;2.34;V;
;Église Saint-Pierre-de-Chaillot;Paroisse;;48.8677;2.29847;V;
;Synagogue de Neuilly;Synagogue;;48.8808;2.2683;V;
;Séminaire des Carmes;Séminaire_(catholique);;48.8481;2.32972;V;
;Église Saint-Marcel de Paris;Paroisse;;48.8374;2.35946;V;
;Église Saint-Martin de Palaiseau;Église_(édifice);;48.7125;2.2403;V;
;Église du Sacré-Cœur de Gentilly;Paroisse;;48.8162;2.33629;V;
;Cathédrale arménienne Saint-Jean-Baptiste de Paris;Cathédrale;;48.8658;2.30701;V;
;Église Notre-Dame-de-l'Assomption de Verrières-le-Buisson;Église_(édifice);;48.7477;2.26393;V;
;Église Saint-Denis de Viry-Châtillon;Église_(édifice);;48.6691;2.37468;V;
;Église Saint-Fiacre de La Ville-du-Bois;Paroisse;;48.6609;2.26769;V;
;Église Saint-Éphrem-le-Syriaque;Paroisse;;48.8483;2.34778;V;
;Chapelle Sainte-Jeanne-d'Arc de Paris;Paroisse;;48.8249;2.33921;V;
;Église Saint-Georges (Villeneuve-Saint-Georges);Église_(édifice);;48.7325;2.44972;V;
;Église Saint-Martin de Sartrouville;Église_(édifice);;48.9457;2.1731;V;
;Séminaire Saint-Sulpice;Séminaire_(catholique);;48.8252;2.27702;V;
;Église Notre-Dame-des-Pauvres d'Issy-les-Moulineaux;Paroisse;;48.8226;2.27502;V;
;Église Notre-Dame-du-Calvaire de Châtillon;Paroisse;;48.8077;2.28429;V;
;Église Notre-Dame de Boulogne;Paroisse;;48.846;2.2365;V;
;Église Saint-Didier de Villiers-le-Bel;Église_(édifice);;49.0083;2.38911;V;
;Église Saint-Jacques-le-Majeur de Montrouge;Paroisse;;48.8181;2.32043;V;
;Église Saint-Leu-Saint-Gilles de Chennevières-lès-Louvres;Église_(édifice);;49.0452;2.45086;V;
;Église Saint-Louis de Vincennes;Église_paroissiale;;48.848;2.4191;V;
;Église Saint-Martin de Groslay;Église_(édifice);;48.9873;2.34377;V;
;Église Saint-Martin de Meudon;Paroisse;;48.8071;2.23638;V;
;Église Saint-Médard de Clichy;Paroisse;;48.904;2.30327;V;
;Église Saint-Nicolas-et-Saint-Marc de Ville-d'Avray;Paroisse;;48.8266;2.18943;V;
;Église Saint-Romain de Sèvres;Paroisse;;48.8239;2.21067;V;
;Église Saint-Étienne d'Issy-les-Moulineaux;Paroisse;;48.8229;2.27675;V;
;Église Sainte-Eugénie de Marnes-la-Coquette;Paroisse;;48.8302;2.17788;V;
;Église Sainte-Geneviève d'Asnières-sur-Seine;Paroisse;;48.9107;2.29336;V;
;Église Sainte-Marie-Madeleine de Massy;Église_(édifice);;48.7305;2.27326;V;
;Couvent des Grands-Augustins;Couvent;;48.8567;2.33352;V;
;Église Sainte-Rita de Paris;Église_(édifice);;48.8446;2.3063;V;
;Basilique du Sacré-Cœur de Montmartre;Basilique_religieuse;;48.8869;2.34306;V;
;Cathédrale Notre-Dame de Paris;Cathédrale;;48.8531;2.34972;V;
;Temple du Marais;Temple;;48.8533;2.36625;V;
;Église Saint-Germain-l'Auxerrois de Paris;Paroisse;;48.8594;2.34111;V;
;Église Saint-Nicolas-du-Chardonnet;Paroisse;;48.8492;2.35028;V;
;Église Saint-Paul-Saint-Louis;Paroisse;;48.8546;2.36142;V;
;Église Saint-Sulpice de Paris;Paroisse;;48.8509;2.3343;V;
;Église du Val-de-Grâce;Église_conventuelle;;48.8405;2.34198;V;
;Abbaye Sainte-Geneviève de Paris;Abbaye;;48.8459;2.34783;V;
;Cathédrale Saint-Louis de Versailles;Cathédrale;;48.7983;2.12417;V;
;Couvent des Madelonnettes (Paris);Prison;;48.8664;2.35889;V;
;Couvent des Madelonnettes (Paris);Couvent;;48.8664;2.35889;V;
;Église Notre-Dame de Clignancourt;Paroisse;;48.8932;2.34503;V;
;Abbaye Saint-Louis-du-Temple de Vauhallan;Abbaye;;48.7287;2.20322;V;
;Temple bouddhique Linh Son;Pagode;;48.8208;2.4643;V;
;Église Saint-Christophe-de-Javel;Paroisse;;48.8445;2.2795;V;
;Église Sainte-Marguerite de Paris;Paroisse;;48.8528;2.38111;V;
;Église de Marie-Médiatrice-de-Toutes-les-Grâces;Basilique_religieuse;;48.8792;2.4025;V;
;Abbaye de Maubuisson;Abbaye;;49.0462;2.1168;V;
;Basilique Sainte-Jeanne-d'Arc de Paris;Paroisse;;48.8915;2.36014;V;
;Église Saint-Jean-Baptiste-de-La-Salle;Paroisse;;48.8412;2.3124;V;
;Église Saint-Pierre-Saint-Paul de Rueil-Malmaison;Paroisse;;48.8764;2.18139;V;
;Église Saint-Pierre-de-Montrouge;Paroisse;;48.8286;2.32694;V;
;Église Sainte-Marie des Batignolles;Paroisse;;48.8868;2.31792;V;
;Synagogue Adas Yereim;Synagogue;;48.8746;2.34281;V;
;Synagogue Adath Israël;Synagogue;;48.8556;2.37889;V;
;Synagogue Rashi (Paris);Synagogue;;48.8745;2.3474;V;
;Église Notre-Dame-d'Espérance de Paris;Paroisse;;48.8557;2.3745;V;
;Église Notre-Dame-de-Lourdes de Paris;Paroisse;;48.8707;2.39948;V;
;Église Saint-André-de-l'Europe;Paroisse;;48.8814;2.32583;V;
;Église Saint-Bernard de la Chapelle;Paroisse;;48.8861;2.3554;V;
;Église Saint-Denys de la Chapelle;Paroisse;;48.8913;2.36;V;
;Église Saint-François-Xavier de Paris;Paroisse;;48.8506;2.31333;V;
;Église Saint-Jean-Baptiste de Grenelle;Paroisse;;48.8432;2.29258;V;
;Église Saint-Leu-Saint-Gilles de Paris;Paroisse;;48.8629;2.35006;V;
;Église Saint-Martin-Saint-Laurent d'Orsay;Église_(édifice);;48.6987;2.18805;V;
;Église Saint-Merri;Paroisse;;48.859;2.351;V;
;Église Saint-Pierre-du-Gros-Caillou;Paroisse;;48.8595;2.30525;V;
;Église Saint-Étienne de Brie-Comte-Robert;Paroisse;;48.6903;2.6085;V;
;Église Sainte-Geneviève des Grandes Carrières;Paroisse;;48.8947;2.3341;V;
;Église Sainte-Hélène de Paris;Paroisse;;48.8966;2.34217;V;
;Cathédrale grecque Saint-Étienne de Paris;Cathédrale;;48.8666;2.2986;V;
;Église Notre-Dame-du-Bon-Conseil de Paris;Paroisse;;48.895;2.34992;V;
;Église Saint-Médard de Brunoy;Collégiale;;48.6975;2.50307;V;
;Église Saint-Rémy de Vanves;Église_(édifice);;48.821;2.28611;V;
;Cathédrale américaine de Paris;Cathédrale;;48.8675;2.30063;V;
;Chapelle Notre-Dame-de-Consolation de Paris;Chapelle;;48.8656;2.30603;V;
;Chapelle Notre-Dame-de-la-Paix de Picpus;Chapelle;;48.8443;2.3973;V;
;Chapelle Notre-Dame-du-Bon-Conseil de Paris;Paroisse;;48.8488;2.3079;V;
;Chapelle Sainte-Rita (Paris);Paroisse;;48.8838;2.33167;V;
;Paroisse Saint-Honoré-d'Eylau;Paroisse;;48.8684;2.28608;V;
;Église Notre-Dame-de-Compassion de Paris;Paroisse;;48.8814;2.28325;V;
;Église Notre-Dame-de-Grâce-de-Passy;Paroisse;;48.8563;2.27999;V;
;Église Notre-Dame-de-Nazareth de Paris;Paroisse;;48.8364;2.28361;V;
;Église Notre-Dame-de-l'Assomption-de-Passy;Paroisse;;48.8556;2.2665;V;
;Église Notre-Dame-de-l'Assomption-de-la-Très-Sainte-Vierge de Saulx-les-Chartreux;Église_(édifice);;48.6926;2.2692;V;
;Église Notre-Dame-de-l'Assomption-des-Buttes-Chaumont;Paroisse;;48.884;2.37833;V;
;Église Notre-Dame-de-la-Salette de Paris;Paroisse;;48.8339;2.30021;V;
;Église Notre-Dame-des-Foyers;Paroisse;;48.8869;2.36984;V;
;Église Notre-Dame-des-Otages;Paroisse;;48.8742;2.40305;V;
;Église Notre-Dame-du-Rosaire de Paris;Paroisse;;48.8292;2.30796;V;
;Église Notre-Dame-du-Travail de Paris;Paroisse;;48.8361;2.31693;V;
;Église Saint-Albert-le-Grand de Paris;Paroisse;;48.828;2.34211;V;
;Église Saint-Antoine-de-Padoue de Paris;Paroisse;;48.8298;2.29439;V;
;Église Saint-Charles-de-Monceau;Paroisse;;48.8828;2.31258;V;
;Église Saint-Dominique de Paris;Paroisse;;48.8321;2.33503;V;
;Église Saint-François-d'Assise de Paris;Paroisse;;48.8803;2.39153;V;
;Église Saint-François-de-Sales de Paris;Paroisse;;48.8847;2.30494;V;
;Église Saint-Gabriel de Paris;Paroisse;;48.8486;2.40608;V;
;Église Saint-Georges de la Villette;Paroisse;;48.8795;2.37475;V;
;Église Saint-Hippolyte de Paris;Paroisse;;48.8214;2.36314;V;
;Église Saint-Honoré-d'Eylau (église ancienne);Paroisse;;48.8691;2.28466;V;
;Église Saint-Honoré-d'Eylau (église nouvelle);Paroisse;;48.8684;2.28608;V;
;Église Saint-Jean-Bosco de Paris;Paroisse;;48.8551;2.39797;V;
;Église Saint-Jean-des-Deux-Moulins;Paroisse;;48.831;2.36083;V;
;Église Saint-Joseph-des-Nations;Paroisse;;48.869;2.37342;V;
;Église Saint-Joseph-des-Épinettes;Paroisse;;48.8936;2.32056;V;
;Église Saint-Martin-des-Champs de Paris;Paroisse;;48.8699;2.36279;V;
;Église Saint-Michel de Paris;Paroisse;;48.889;2.3245;V;
;Église Saint-Pierre d'Igny;Église_(édifice);;48.7423;2.22557;V;
;Église Saint-Éloi de Paris;Église_paroissiale;;48.8447;2.38872;V;
;Église Sainte-Claire de Paris;Paroisse;;48.8888;2.39511;V;
;Église Sainte-Colette-des-Buttes-Chaumont;Paroisse;;48.8839;2.38656;V;
;Église du Bon-Pasteur de Paris;Paroisse;;48.8565;2.39192;V;
;Église du Cœur-Eucharistique-de-Jésus;Paroisse;;48.8677;2.40647;V;
;Église Saint-Eugène-Sainte-Cécile;Paroisse;;48.8733;2.34714;V;
;Église Saint-André-des-Arts;Paroisse;;48.8531;2.34291;V;
;Église Notre-Dame-du-Bourg de Rabastens;Paroisse;;48.8867;2.34203;V;
;Église Saint-Denis du Thillay;Église_(édifice);;49.0011;2.46887;V;
;Grande Mosquée de Paris;Mosquée;;48.8419;2.355;V;
;Église Notre-Dame-de-Lorette de Paris;Église_paroissiale;;48.8764;2.33889;V;
;Église de la Sainte-Trinité de Paris;Paroisse;;48.8769;2.3315;V;
;Chapelle expiatoire;Chapelle;;48.8736;2.32278;V;
;Abbaye de Penthemont;Abbaye;;48.8564;2.32194;V;
;Église Saint-Denys-du-Saint-Sacrement;Paroisse;;48.86;2.3652;V;
;Église Saint-Jean de Montmartre;Paroisse;;48.8841;2.33788;V;
;Basilique Notre-Dame-des-Victoires de Paris;Paroisse;;48.8667;2.34093;V;
;Basilique Notre-Dame-du-Perpétuel-Secours;Paroisse;;48.8614;2.38694;V;
;Cathédrale Sainte-Geneviève-et-Saint-Maurice de Nanterre;Cathédrale;;48.8908;2.19611;V;
;Collégiale Saint-Martin de Montmorency;Collégiale;;48.9851;2.31891;V;
;Grande synagogue de Paris;Synagogue;;48.8756;2.33639;V;
;Synagogue Chasseloup-Laubat;Synagogue;;48.8474;2.30486;V;
;Synagogue Nazareth;Synagogue;;48.8669;2.36;V;
;Synagogue de la rue des Tournelles;Synagogue;;48.8553;2.36692;V;
;Église Notre-Dame-d'Auteuil;Paroisse;;48.8472;2.26936;V;
;Église Notre-Dame-des-Blancs-Manteaux;Église;;48.8588;2.35751;V;
;Église Saint-Antoine-des-Quinze-Vingts;Paroisse;;48.8487;2.37411;V;
;Église Saint-Gervais-Saint-Protais de Paris;Paroisse;;48.8556;2.35444;V;
;Église Saint-Jacques-du-Haut-Pas;Paroisse;;48.8436;2.34139;V;
;Église Saint-Séverin;Paroisse;;48.8521;2.34565;V;
;Église Sainte-Élisabeth-de-Hongrie;Paroisse;;48.866;2.36081;V;
;Église Saint-Louis-en-l'Île;Église;;48.8513;2.3576;V;
;Basilique Sainte-Clotilde de Paris;Paroisse;;48.8583;2.31917;V;
;Église Notre-Dame-de-la-Nativité de Bercy;Paroisse;;48.8362;2.38708;V;
;Église Saint-Ferdinand-des-Ternes;Paroisse;;48.8791;2.29074;V;
;Église Saint-Joseph-Artisan de Paris;Paroisse;;48.8816;2.36753;V;
;Église Saint-Louis-d'Antin;Paroisse;;48.8745;2.3283;V;
;Église Saint-Nicolas-des-Champs;Paroisse;;48.8656;2.35367;V;
;Cloître et église des Billettes;Cloître;;48.858;2.355;V;
;Église Notre-Dame-de-la-Gare de Paris;Paroisse;;48.8297;2.36833;V;
;Église Saint-Julien-le-Pauvre de Paris;Église_(édifice);;48.852;2.34711;V;
;Église évangélique allemande de Paris;Paroisse;;48.8794;2.33111;V;
;Chapelle Notre-Dame-du-Lys;Chapelle;;48.8438;2.30863;V;
;Église Saint-Symphorien de Versailles;Église_(édifice);;48.8041;2.14608;V;
;Église Saint-André de Saint-Maurice (Val-de-Marne);Paroisse;;48.8156;2.45917;V;
;Église réformée de l'Annonciation;Paroisse;;48.8619;2.28056;V;
;Chapelle du Père-Lachaise;Chapelle;;48.8612;2.39287;V;
;Église réformée Saint-Jean;Paroisse;;48.8575;2.30802;V;
;Église Sainte-Marie-Madeleine de Domont;Église_(édifice);;49.0268;2.32631;V;
;Église évangélique de la Rédemption de Paris;Paroisse;;48.8738;2.33973;V;
;Mosquée Moubarak de Saint-Prix;Mosquée;;49.0115;2.25838;V;
;Temple des Batignolles;Temple;;48.8824;2.32205;V;
;Église Saint-Charles-Borromée de Joinville-le-Pont;Paroisse;;48.8195;2.46558;V;
;Église Saint-Prix de Saint-Prix;Église_(édifice);;49.0165;2.26621;V;
;Église Sainte-Anne de Polangis;Paroisse;;48.822;2.47757;V;
;Église Saint-Ambroise de Paris;Paroisse;;48.8611;2.37556;V;
;Église Sainte-Anne de la Butte-aux-Cailles;Paroisse;;48.8261;2.35;V;
;Église de l'Immaculée-Conception de Paris;Paroisse;;48.8459;2.40333;V;
;Synagogue Charles Liché;Synagogue;;48.8553;2.36667;V;
;Église Saint-Médard de Paris;Paroisse;;48.8399;2.35028;V;
;Cathédrale Notre-Dame-du-Liban de Paris;Église_paroissiale;;48.844;2.34534;V;
;Sainte-Chapelle de Vincennes;Chapelle;;48.8424;2.43636;V;
;Église Saint-Martin de Bièvres;Église_(édifice);;48.7544;2.21764;V;
;Église Saint-Martin de Longjumeau;Église_(édifice);;48.6929;2.29354;V;
;Temple protestant du Foyer de l'Âme;Temple;;48.8558;2.36944;V;
;Église Notre-Dame-de-Chine de Paris;Paroisse;;48.8214;2.36314;V;
;Église Saint-Rémi de Gif-sur-Yvette;Église_(édifice);;48.7029;2.13543;V;
;Église Saint-Stanislas des Blagis;Paroisse;;48.7786;2.29056;V;
;Église Saint-Denis d'Athis-Mons;Église_(édifice);;48.7085;2.38964;V;
;Église Saint-Étienne de Chilly-Mazarin;Église_(édifice);;48.703;2.31261;V;
;Chapelle Notre-Dame de Valmy;Chapelle;;48.8275;2.40222;V;
;Chapelle de Conflans;Chapelle;;48.8214;2.40556;V;
;Temple de Charenton-le-Pont;Temple;;48.8236;2.41611;V;
;Temple de la Petite Étoile;Temple;;48.8928;2.28413;V;
;Église Saint-Honest;Paroisse;;48.7171;2.49188;V;
;Église Saint-Pierre de Charenton-le-Pont;Paroisse;;48.8217;2.41528;V;
;Église Saint-Martin de Lognes;Église_paroissiale;;48.8354;2.6277;V;
;Église Saint-Éloi de Roissy-en-France;Église_(édifice);;49.0005;2.51516;V;
;Église Notre-Dame-de-l'Assomption du Plessis-Gassot;Église_(édifice);;49.0341;2.41351;V;
;Église Saint-Jean-Baptiste du Plessis-Robinson;Église_paroissiale;;48.7826;2.26256;V;
;Église Saint-Ouen de Saint-Ouen-l'Aumône;Église_(édifice);;49.0391;2.10467;V;
;Église Saint-Philippe-et-Saint-Jacques de Châtillon;Église_paroissiale;;48.7999;2.29023;V;
;Église Saint-Pierre-Saint-Paul de Clamart;Église_paroissiale;;48.7992;2.26325;V;
